{"cohort":{"denominator":10,"dispositions":{"error":2,"partial":6,"runnerCompleted":2},"noAutomaticRetry":true,"selectionType":"fixed-reviewed-convenience-pilot"},"collectionWindow":{"endedAt":"2026-08-01T20-04-10-294Z","startedAt":"2026-08-01T18-57-11-207Z"},"datasetId":"web-uplift-fixed10-operational-pilot-2026-08-01","publication":{"authorization":"Explicitly authorized after the run for this sanitized derivative.","claimsExcluded":["scores","pass rates","rankings","completed-quality claims"],"scope":"operational pilot; not a site ranking or replacement main report"},"rows":[{"aggregates":null,"archetype":"documentation","coverage":{"blocked":0,"duplicates":0,"expected":58,"judged":0,"missing":58,"notRun":0,"recorded":0,"unknown":0},"disposition":"error","journey":{"actions":[{"ordinal":1,"outcome":"mutation-blocked","reasonCode":"mutation-like-url","type":"baseline-load"},{"ordinal":2,"outcome":"skipped-after-blocker","reasonCode":"journey-aborted-after-blocker","type":"bounded-scroll"}],"status":"partial"},"methodInvalid":false,"ordinal":1,"origin":"https://github.com","reasonCode":"missing-report","reasonSummary":"The authoritative ledger records missing-report. Permit expiry is not claimed: the retained timestamps place the start before expiry."},{"aggregates":null,"archetype":"blocked-complex","coverage":{"blocked":0,"duplicates":0,"expected":58,"judged":0,"missing":58,"notRun":0,"recorded":0,"unknown":0},"disposition":"error","journey":{"actions":[{"ordinal":1,"outcome":"invalidated-cross-origin-state","reasonCode":"completed-cross-origin-state","type":"baseline-load"},{"ordinal":2,"outcome":"invalidated-cross-origin-state","reasonCode":"completed-cross-origin-state","type":"bounded-scroll"}],"status":"invalid"},"methodInvalid":false,"ordinal":2,"origin":"https://web.facebook.com","reasonCode":"runner-error","reasonSummary":"The authoritative ledger records runner-error. The runner invalidated completed journey states that crossed away from the reviewed origin."},{"aggregates":{"cookieAttributeCounts":{"httpOnly":2,"sameSiteLax":2,"sameSiteNone":0,"sameSiteStrict":0,"sameSiteUnspecified":0,"secure":2,"thirdParty":0,"total":2},"firstPartyOriginCount":1,"httpStatusClassCounts":{"2xx":41,"no-response":2},"performance":{"firstContentfulPaintMs":1482.05,"largestContentfulPaintMs":1499.69,"loadEventEndMs":1474.15,"longTaskCount":1,"longestTaskMs":67.69,"totalBlockingTimeMs":17.69,"traceDurationMs":3618.07},"requestCount":43,"resourceTypes":{"document":{"count":1,"transferBytes":85969},"image":{"count":7,"transferBytes":972},"other":{"count":15,"transferBytes":1805},"script":{"count":8,"transferBytes":715201},"stylesheet":{"count":2,"transferBytes":3546},"xhr-fetch":{"count":10,"transferBytes":8531}},"securityHeaderPresence":{"content-security-policy":false,"permissions-policy":true,"referrer-policy":false,"strict-transport-security":false,"x-content-type-options":false,"x-frame-options":true},"thirdPartyOriginCount":4,"transferBytes":816024},"archetype":"search-portal","coverage":{"blocked":0,"duplicates":0,"expected":58,"judged":58,"missing":0,"notRun":0,"recorded":58,"unknown":0},"disposition":"runner-completed","journey":{"actions":[{"ordinal":1,"outcome":"mutation-blocked","reasonCode":"mutation-method-post","type":"baseline-load"},{"ordinal":2,"outcome":"skipped-after-blocker","reasonCode":"journey-aborted-after-blocker","type":"bounded-scroll"}],"status":"partial"},"methodInvalid":true,"ordinal":3,"origin":"https://www.google.com","reasonCode":null,"reasonSummary":"The ledger classified this row completed, but its console pass used an unsupported absence-of-error method."},{"aggregates":{"cookieAttributeCounts":{"httpOnly":0,"sameSiteLax":0,"sameSiteNone":1,"sameSiteStrict":0,"sameSiteUnspecified":0,"secure":1,"thirdParty":0,"total":1},"firstPartyOriginCount":1,"httpStatusClassCounts":{"2xx":8},"performance":{"firstContentfulPaintMs":677.84,"largestContentfulPaintMs":677.84,"loadEventEndMs":642.74,"longTaskCount":0,"longestTaskMs":0,"totalBlockingTimeMs":0,"traceDurationMs":4255.9},"requestCount":8,"resourceTypes":{"document":{"count":3,"transferBytes":167826},"image":{"count":2,"transferBytes":0},"other":{"count":1,"transferBytes":4774},"script":{"count":2,"transferBytes":342075}},"securityHeaderPresence":{"content-security-policy":false,"permissions-policy":false,"referrer-policy":false,"strict-transport-security":true,"x-content-type-options":true,"x-frame-options":true},"thirdPartyOriginCount":3,"transferBytes":514675},"archetype":"interaction-heavy","coverage":{"blocked":9,"duplicates":0,"expected":58,"judged":49,"missing":0,"notRun":0,"recorded":58,"unknown":0},"disposition":"partial","journey":{"actions":[{"ordinal":1,"outcome":"navigation-blocked","reasonCode":"cross-origin-document","type":"baseline-load"},{"ordinal":2,"outcome":"skipped-after-blocker","reasonCode":"journey-aborted-after-blocker","type":"bounded-scroll"}],"status":"partial"},"methodInvalid":false,"ordinal":4,"origin":"https://www.reddit.com","reasonCode":"atomic-coverage-incomplete","reasonSummary":"Atomic coverage was incomplete after a humanity challenge and cross-origin navigation block."},{"aggregates":{"cookieAttributeCounts":{"httpOnly":0,"sameSiteLax":1,"sameSiteNone":6,"sameSiteStrict":0,"sameSiteUnspecified":0,"secure":3,"thirdParty":0,"total":7},"firstPartyOriginCount":1,"httpStatusClassCounts":{"2xx":40,"no-response":3},"performance":{"firstContentfulPaintMs":null,"largestContentfulPaintMs":null,"loadEventEndMs":1391.03,"longTaskCount":0,"longestTaskMs":0,"totalBlockingTimeMs":0,"traceDurationMs":2567.35},"requestCount":43,"resourceTypes":{"document":{"count":2,"transferBytes":291195},"font":{"count":1,"transferBytes":41427},"image":{"count":13,"transferBytes":192214},"other":{"count":1,"transferBytes":15767},"script":{"count":15,"transferBytes":449270},"stylesheet":{"count":8,"transferBytes":109598},"xhr-fetch":{"count":3,"transferBytes":1989}},"securityHeaderPresence":{"content-security-policy":false,"permissions-policy":false,"referrer-policy":false,"strict-transport-security":false,"x-content-type-options":false,"x-frame-options":false},"thirdPartyOriginCount":3,"transferBytes":1101460},"archetype":"commerce","coverage":{"blocked":19,"duplicates":0,"expected":58,"judged":39,"missing":0,"notRun":0,"recorded":58,"unknown":0},"disposition":"partial","journey":{"actions":[{"ordinal":1,"outcome":"mutation-blocked","reasonCode":"mutation-method-post","type":"baseline-load"},{"ordinal":2,"outcome":"skipped-after-blocker","reasonCode":"journey-aborted-after-blocker","type":"bounded-scroll"}],"status":"partial"},"methodInvalid":false,"ordinal":5,"origin":"https://www.amazon.com","reasonCode":"atomic-coverage-incomplete","reasonSummary":"Atomic coverage was incomplete after mutation-like POST traffic was blocked."},{"aggregates":{"cookieAttributeCounts":{"httpOnly":4,"sameSiteLax":0,"sameSiteNone":7,"sameSiteStrict":0,"sameSiteUnspecified":0,"secure":6,"thirdParty":0,"total":7},"firstPartyOriginCount":1,"httpStatusClassCounts":{"2xx":38,"3xx":2},"performance":{"firstContentfulPaintMs":1123.66,"largestContentfulPaintMs":1123.66,"loadEventEndMs":978.36,"longTaskCount":1,"longestTaskMs":138.37,"totalBlockingTimeMs":88.37,"traceDurationMs":2365.67},"requestCount":40,"resourceTypes":{"document":{"count":2,"transferBytes":57467},"image":{"count":26,"transferBytes":312950},"other":{"count":1,"transferBytes":1844},"script":{"count":9,"transferBytes":281579},"stylesheet":{"count":2,"transferBytes":28291}},"securityHeaderPresence":{"content-security-policy":true,"permissions-policy":false,"referrer-policy":false,"strict-transport-security":true,"x-content-type-options":true,"x-frame-options":false},"thirdPartyOriginCount":2,"transferBytes":682131},"archetype":"simple-static","coverage":{"blocked":0,"duplicates":0,"expected":58,"judged":58,"missing":0,"notRun":0,"recorded":58,"unknown":0},"disposition":"runner-completed","journey":{"actions":[{"ordinal":1,"outcome":"performed","reasonCode":"same-origin-get-navigation-completed","type":"baseline-load"},{"ordinal":2,"outcome":"performed","reasonCode":"bounded-scroll-completed","type":"bounded-scroll"}],"status":"partial"},"methodInvalid":true,"ordinal":6,"origin":"https://en.wikipedia.org","reasonCode":null,"reasonSummary":"The ledger classified this row completed, but its console pass used an unsupported absence-of-error method."},{"aggregates":{"cookieAttributeCounts":{"httpOnly":3,"sameSiteLax":5,"sameSiteNone":9,"sameSiteStrict":0,"sameSiteUnspecified":0,"secure":9,"thirdParty":0,"total":14},"firstPartyOriginCount":1,"httpStatusClassCounts":{"2xx":363,"4xx":3,"no-response":2},"performance":{"firstContentfulPaintMs":755.89,"largestContentfulPaintMs":4760.96,"loadEventEndMs":966.58,"longTaskCount":13,"longestTaskMs":632.17,"totalBlockingTimeMs":994.02,"traceDurationMs":8759.74},"requestCount":368,"resourceTypes":{"document":{"count":4,"transferBytes":279878},"font":{"count":11,"transferBytes":276529},"image":{"count":16,"transferBytes":327630},"other":{"count":28,"transferBytes":38059},"script":{"count":259,"transferBytes":3500057},"stylesheet":{"count":29,"transferBytes":83673},"xhr-fetch":{"count":21,"transferBytes":444497}},"securityHeaderPresence":{"content-security-policy":true,"permissions-policy":true,"referrer-policy":false,"strict-transport-security":true,"x-content-type-options":true,"x-frame-options":true},"thirdPartyOriginCount":27,"transferBytes":4950323},"archetype":"content-news","coverage":{"blocked":6,"duplicates":0,"expected":58,"judged":50,"missing":0,"notRun":2,"recorded":58,"unknown":0},"disposition":"partial","journey":{"actions":[{"ordinal":1,"outcome":"mutation-blocked","reasonCode":"mutation-method-post","type":"baseline-load"},{"ordinal":2,"outcome":"skipped-after-blocker","reasonCode":"journey-aborted-after-blocker","type":"bounded-scroll"}],"status":"partial"},"methodInvalid":false,"ordinal":7,"origin":"https://www.nytimes.com","reasonCode":"atomic-cove